{
  "schema_version": "0.1",
  "record_status": "provisional_gate0",
  "non_product": true,
  "snapshot_id": "G0-REPO-CONTROL-REPRESENTATIVE",
  "repository": {
    "owner": "chasebryan",
    "name": "orange",
    "url": "https://github.com/chasebryan/orange",
    "visibility": "public",
    "default_branch": "main"
  },
  "observed_at": "2026-07-11T12:00:00Z",
  "observed_by": "Bootstrap Repository Steward",
  "revision": {
    "branch": "gate0/foundation-security",
    "head": "f50d35227a04831d459b3358db65b80093e8123a"
  },
  "security_features": {
    "dependency_graph": {
      "state": "enabled",
      "evidence_refs": ["G0-CONTROL-EVIDENCE-REPOSITORY"]
    },
    "dependabot_alerts": {
      "state": "enabled",
      "evidence_refs": ["G0-CONTROL-EVIDENCE-REPOSITORY"]
    },
    "dependabot_security_updates": {
      "state": "enabled",
      "evidence_refs": ["G0-CONTROL-EVIDENCE-REPOSITORY"]
    },
    "secret_scanning": {
      "state": "enabled",
      "evidence_refs": ["G0-CONTROL-EVIDENCE-REPOSITORY"]
    },
    "secret_scanning_push_protection": {
      "state": "enabled",
      "evidence_refs": ["G0-CONTROL-EVIDENCE-REPOSITORY"]
    },
    "secret_scanning_non_provider_patterns": {
      "state": "disabled",
      "evidence_refs": ["G0-CONTROL-EVIDENCE-REPOSITORY"],
      "explanation": "The representative observation records this feature separately rather than implying coverage from provider-pattern scanning."
    },
    "secret_scanning_validity_checks": {
      "state": "disabled",
      "evidence_refs": ["G0-CONTROL-EVIDENCE-REPOSITORY"],
      "explanation": "The representative observation records validity checks as disabled."
    },
    "private_vulnerability_reporting": {
      "state": "enabled",
      "evidence_refs": ["G0-CONTROL-EVIDENCE-REPOSITORY"]
    },
    "code_scanning": {
      "state": "disabled",
      "evidence_refs": ["G0-CONTROL-EVIDENCE-REPOSITORY"],
      "explanation": "This example represents the pre-workflow observation; it is not the desired final state."
    }
  },
  "actions": {
    "enabled": {
      "state": "enabled",
      "evidence_refs": ["G0-CONTROL-EVIDENCE-ACTIONS"]
    },
    "allowed_actions": "selected",
    "selected_actions": [
      "DavidAnson/markdownlint-cli2-action",
      "actions/checkout",
      "actions/dependency-review-action",
      "actions/upload-artifact",
      "github/codeql-action/upload-sarif",
      "ossf/scorecard-action",
      "zizmorcore/zizmor-action"
    ],
    "sha_pinning_required": true,
    "default_workflow_permissions": "read",
    "can_approve_pull_request_reviews": false,
    "evidence_refs": ["G0-CONTROL-EVIDENCE-ACTIONS"]
  },
  "default_branch_policy": {
    "protection_mechanism": "ruleset",
    "policy_identifiers": ["G0-REPRESENTATIVE-MAIN-RULESET"],
    "require_pull_request": true,
    "required_approvals": 0,
    "require_code_owner_review": false,
    "require_conversation_resolution": true,
    "required_status_checks": [
      "Dependency Review / policy",
      "Required CI / docs-policy-workflows"
    ],
    "strict_status_checks": true,
    "block_force_pushes": true,
    "block_deletions": true,
    "require_linear_history": true,
    "require_signed_commits": false,
    "bypass_actors": [],
    "evidence_refs": ["G0-CONTROL-EVIDENCE-BRANCH"],
    "explanation": "This synthetic observation exercises the protected-main ruleset record shape required by Gate 0."
  },
  "merge_policy": {
    "allow_merge_commit": true,
    "allow_squash_merge": true,
    "allow_rebase_merge": true,
    "allow_auto_merge": false,
    "allow_update_branch": false,
    "delete_branch_on_merge": false,
    "web_commit_signoff_required": false,
    "evidence_refs": ["G0-CONTROL-EVIDENCE-REPOSITORY"]
  },
  "evidence_sources": [
    {
      "evidence_id": "G0-CONTROL-EVIDENCE-ACTIONS",
      "method": "github_rest_api",
      "locator": "GET /repos/chasebryan/orange/actions/permissions and workflow endpoint",
      "response_digest": {
        "algorithm": "sha256",
        "value": "aaaaaaaaaaaaaaaaaaaaaaaaaaaaaaaaaaaaaaaaaaaaaaaaaaaaaaaaaaaaaaaa"
      },
      "archive_state": "archived",
      "response_path": "conformance/foundation/valid/repository-control-snapshot.json"
    },
    {
      "evidence_id": "G0-CONTROL-EVIDENCE-BRANCH",
      "method": "github_rest_api",
      "locator": "GET /repos/chasebryan/orange/branches/main/protection and /rulesets",
      "response_digest": {
        "algorithm": "sha256",
        "value": "bbbbbbbbbbbbbbbbbbbbbbbbbbbbbbbbbbbbbbbbbbbbbbbbbbbbbbbbbbbbbbbb"
      },
      "archive_state": "not_archived",
      "explanation": "The representative fixture does not contain an archived API response."
    },
    {
      "evidence_id": "G0-CONTROL-EVIDENCE-REPOSITORY",
      "method": "github_rest_api",
      "locator": "GET /repos/chasebryan/orange and security feature endpoints",
      "response_digest": {
        "algorithm": "sha256",
        "value": "cccccccccccccccccccccccccccccccccccccccccccccccccccccccccccccccc"
      },
      "archive_state": "not_archived",
      "explanation": "The representative fixture does not contain an archived API response."
    }
  ],
  "exceptions": [
    {
      "exception_id": "G0-EXCEPTION-CODE-SCANNING-BOOTSTRAP",
      "control": "code_scanning",
      "scope": "The representative pre-workflow repository-control observation only.",
      "rationale": "The synthetic snapshot models the interval before the candidate workflow is active.",
      "risk": "A repository change may not receive code-scanning analysis during the modeled interval.",
      "owner": "Bootstrap Repository Steward",
      "compensating_control": "Run the local foundation validator and require manual review of workflow changes.",
      "resolution": "Enable and verify code scanning before treating the control snapshot as current evidence.",
      "expires_at": "2026-07-18T12:00:00Z",
      "approved_by": "Bootstrap Repository Steward",
      "approved_at": "2026-07-11T12:00:00Z",
      "approval_reference": "Synthetic conformance fixture; not an operational exception approval.",
      "review_trigger": "Any code-scanning configuration change or arrival of the expiry time.",
      "evidence_refs": ["G0-CONTROL-EVIDENCE-REPOSITORY"]
    }
  ],
  "limitations": [
    "This is representative conformance data with synthetic response digests, not an authoritative current GitHub observation.",
    "An enabled API field does not establish that an end-to-end workflow or protection rule is effective."
  ]
}
